### ISSUE TITLE
Possible test flake for:   Should validate the egress IP functionality against remote hosts

### ISSUE THREAD

**Issue by andreaskaris** [ovn-org/ovn-kubernetes#2552]
Flaky test for: `Should validate the egress IP functionality against remote hosts`

I ran into this while working on: https://github.com/ovn-org/ovn-kubernetes/pull/2540

~~~
export   KIND_CLUSTER_NAME=ovn
export      KIND_INSTALL_INGRESS=true
export      KIND_ALLOW_SYSTEM_WRITES=true
export      PARALLEL=true
 export     JOB_NAME=control-plane-noHA-local-ipv4-snatGW-1br
export      OVN_HYBRID_OVERLAY_ENABLE=true
export      OVN_MULTICAST_ENABLE=true
export      OVN_EMPTY_LB_EVENTS=true
export      OVN_HA=false
export      OVN_DISABLE_SNAT_MULTIPLE_GWS=false
export      OVN_GATEWAY_MODE=local
export      OVN_SECOND_BRIDGE=false
export      KIND_IPV4_SUPPORT=true
export     KIND_IPV6_SUPPORT=false
~~~

~~~
• Failure [72.059 seconds]
e2e egress IP validation
/home/runner/work/ovn-kubernetes/ovn-kubernetes/test/e2e/e2e.go:802
  Should validate the egress IP functionality against remote hosts [It]
  /home/runner/work/ovn-kubernetes/ovn-kubernetes/test/e2e/e2e.go:1026

  Oct  7 15:44:43.837: Step 8. Check connectivity from that one to an external "node" and verify that the IP is the node IP, failed, err: timed out waiting for the condition
  Unexpected error:
      <*errors.errorString | 0xc000357140>: {
          s: "timed out waiting for the condition",
      }
      timed out waiting for the condition
  occurred

  /home/runner/work/ovn-kubernetes/ovn-kubernetes/test/e2e/e2e.go:1126
------------------------------
e2e egress IP validation 
  Should validate the egress IP functionality against remote hosts
  /home/runner/work/ovn-kubernetes/ovn-kubernetes/test/e2e/e2e.go:1026
[BeforeEach] e2e egress IP validation
  /home/runner/go/pkg/mod/k8s.io/kubernetes@v1.22.2/test/e2e/framework/framework.go:185
STEP: Creating a kubernetes client
~~~

~~~
Oct  7 15:43:55.724: INFO: stdout: "<html><body><h1>It works!</h1></body></html>\n"
Oct  7 15:43:55.763: INFO: the test external container did not have any trace of the IPs: [172.18.1.2] being logged, last logs: 172.18.1.3 - - [07/Oct/2021:15:43:55 +0000] "GET / HTTP/1.1" 200 45
Oct  7 15:43:56.563: INFO: Running '/usr/local/bin/kubectl --server=https://10.1.1.167:11337 --kubeconfig=/home/runner/admin.conf --namespace=egressip-9947 exec e2e-egressip-pod-2 -- curl --connect-timeout 2 172.18.0.5:80'
Oct  7 15:43:56.696: INFO: stderr: "  % Total    % Received % Xferd  Average Speed   Time    Time     Time  Current\n                                 Dload  Upload   Total   Spent    Left  Speed\n\r  0     0    0     0    0     0      0      0 --:--:-- --:--:-- --:--:--     0\r100    45  100    45    0     0  15000      0 --:--:-- --:--:-- --:--:-- 15000\n"
Oct  7 15:43:56.696: INFO: stdout: "<html><body><h1>It works!</h1></body></html>\n"
STEP: 5. Check connectivity from one pod to the other and verify that the connection is achieved
Oct  7 15:43:56.734: INFO: Running '/usr/local/bin/kubectl --server=https://10.1.1.167:11337 --kubeconfig=/home/runner/admin.conf --namespace=egressip-9947 exec e2e-egressip-pod-1 -- curl --connect-timeout 2 10.244.1.7:8080/hostname'
Oct  7 15:43:56.886: INFO: stderr: "  % Total    % Received % Xferd  Average Speed   Time    Time     Time  Current\n                                 Dload  Upload   Total   Spent    Left  Speed\n\r  0     0    0     0    0     0      0      0 --:--:-- --:--:-- --:--:--     0\r100    18  100    18    0     0   2000      0 --:--:-- --:--:-- --:--:--  2000\n"
Oct  7 15:43:56.886: INFO: stdout: "e2e-egressip-pod-2"
STEP: 6. Check connectivity from both pods to the api-server (running hostNetwork:true) and verifying that the connection is achieved
Oct  7 15:43:56.886: INFO: Running '/usr/local/bin/kubectl --server=https://10.1.1.167:11337 --kubeconfig=/home/runner/admin.conf --namespace=default get svc kubernetes -o jsonpath='{.spec.clusterIP}''
Oct  7 15:43:56.946: INFO: stderr: ""
Oct  7 15:43:56.946: INFO: stdout: "'10.96.0.1'"
Oct  7 15:43:56.946: INFO: Running '/usr/local/bin/kubectl --server=https://10.1.1.167:11337 --kubeconfig=/home/runner/admin.conf --namespace=egressip-9947 exec e2e-egressip-pod-1 -- curl --connect-timeout 2 -k https://10.96.0.1:443/version'
Oct  7 15:43:57.140: INFO: stderr: "  % Total    % Received % Xferd  Average Speed   Time    Time     Time  Current\n                                 Dload  Upload   Total   Spent    Left  Speed\n\r  0     0    0     0    0     0      0      0 --:--:-- --:--:-- --:--:--     0\r100   263  100   263    0     0   9392      0 --:--:-- --:--:-- --:--:--  9392\n"
Oct  7 15:43:57.140: INFO: stdout: "{\n  \"major\": \"1\",\n  \"minor\": \"20\",\n  \"gitVersion\": \"v1.20.2\",\n  \"gitCommit\": \"faecb196815e248d3ecfb03c680a4507229c2a56\",\n  \"gitTreeState\": \"clean\",\n  \"buildDate\": \"2021-03-11T06:23:38Z\",\n  \"goVersion\": \"go1.15.5\",\n  \"compiler\": \"gc\",\n  \"platform\": \"linux/amd64\"\n}"
Oct  7 15:43:57.141: INFO: Running '/usr/local/bin/kubectl --server=https://10.1.1.167:11337 --kubeconfig=/home/runner/admin.conf --namespace=egressip-9947 exec e2e-egressip-pod-2 -- curl --connect-timeout 2 -k https://10.96.0.1:443/version'
Oct  7 15:43:57.309: INFO: stderr: "  % Total    % Received % Xferd  Average Speed   Time    Time     Time  Current\n                                 Dload  Upload   Total   Spent    Left  Speed\n\r  0     0    0     0    0     0      0      0 --:--:-- --:--:-- --:--:--     0\r100   263  100   263    0     0  15470      0 --:--:-- --:--:-- --:--:-- 15470\n"
Oct  7 15:43:57.309: INFO: stdout: "{\n  \"major\": \"1\",\n  \"minor\": \"20\",\n  \"gitVersion\": \"v1.20.2\",\n  \"gitCommit\": \"faecb196815e248d3ecfb03c680a4507229c2a56\",\n  \"gitTreeState\": \"clean\",\n  \"buildDate\": \"2021-03-11T06:23:38Z\",\n  \"goVersion\": \"go1.15.5\",\n  \"compiler\": \"gc\",\n  \"platform\": \"linux/amd64\"\n}"
STEP: 7. Update one of the pods, unmatching the EgressIP
STEP: 8. Check connectivity from that one to an external "node" and verify that the IP is the node IP.
Oct  7 15:43:57.328: INFO: Running '/usr/local/bin/kubectl --server=https://10.1.1.167:11337 --kubeconfig=/home/runner/admin.conf --namespace=egressip-9947 exec e2e-egressip-pod-2 -- curl --connect-timeout 2 172.18.0.5:80'
Oct  7 15:43:59.477: INFO: rc: 28
Oct  7 15:44:00.477: INFO: Running '/usr/local/bin/kubectl --server=https://10.1.1.167:11337 --kubeconfig=/home/runner/admin.conf --namespace=egressip-9947 exec e2e-egressip-pod-2 -- curl --connect-timeout 2 172.18.0.5:80'
Oct  7 15:44:02.607: INFO: rc: 28
Oct  7 15:44:03.477: INFO: Running '/usr/local/bin/kubectl --server=https://10.1.1.167:11337 --kubeconfig=/home/runner/admin.conf --namespace=egressip-9947 exec e2e-egressip-pod-2 -- curl --connect-timeout 2 172.18.0.5:80'
Oct  7 15:44:05.622: INFO: rc: 28
Oct  7 15:44:06.478: INFO: Running '/usr/local/bin/kubectl --server=https://10.1.1.167:11337 --kubeconfig=/home/runner/admin.conf --namespace=egressip-9947 exec e2e-egressip-pod-2 -- curl --connect-timeout 2 172.18.0.5:80'
Oct  7 15:44:08.627: INFO: rc: 28
Oct  7 15:44:09.477: INFO: Running '/usr/local/bin/kubectl --server=https://10.1.1.167:11337 --kubeconfig=/home/runner/admin.conf --namespace=egressip-9947 exec e2e-egressip-pod-2 -- curl --connect-timeout 2 172.18.0.5:80'
Oct  7 15:44:11.615: INFO: rc: 28
Oct  7 15:44:12.478: INFO: Running '/usr/local/bin/kubectl --server=https://10.1.1.167:11337 --kubeconfig=/home/runner/admin.conf --namespace=egressip-9947 exec e2e-egressip-pod-2 -- curl --connect-timeout 2 172.18.0.5:80'
Oct  7 15:44:14.606: INFO: rc: 28
Oct  7 15:44:15.478: INFO: Running '/usr/local/bin/kubectl --server=https://10.1.1.167:11337 --kubeconfig=/home/runner/admin.conf --namespace=egressip-9947 exec e2e-egressip-pod-2 -- curl --connect-timeout 2 172.18.0.5:80'
Oct  7 15:44:17.615: INFO: rc: 28
Oct  7 15:44:18.478: INFO: Running '/usr/local/bin/kubectl --server=https://10.1.1.167:11337 --kubeconfig=/home/runner/admin.conf --namespace=egressip-9947 exec e2e-egressip-pod-2 -- curl --connect-timeout 2 172.18.0.5:80'
Oct  7 15:44:20.648: INFO: rc: 28
Oct  7 15:44:21.477: INFO: Running '/usr/local/bin/kubectl --server=https://10.1.1.167:11337 --kubeconfig=/home/runner/admin.conf --namespace=egressip-9947 exec e2e-egressip-pod-2 -- curl --connect-timeout 2 172.18.0.5:80'
Oct  7 15:44:23.624: INFO: rc: 28
Oct  7 15:44:24.478: INFO: Running '/usr/local/bin/kubectl --server=https://10.1.1.167:11337 --kubeconfig=/home/runner/admin.conf --namespace=egressip-9947 exec e2e-egressip-pod-2 -- curl --connect-timeout 2 172.18.0.5:80'
Oct  7 15:44:26.626: INFO: rc: 28
Oct  7 15:44:27.477: INFO: Running '/usr/local/bin/kubectl --server=https://10.1.1.167:11337 --kubeconfig=/home/runner/admin.conf --namespace=egressip-9947 exec e2e-egressip-pod-2 -- curl --connect-timeout 2 172.18.0.5:80'
Oct  7 15:44:29.624: INFO: rc: 28
Oct  7 15:44:30.477: INFO: Running '/usr/local/bin/kubectl --server=https://10.1.1.167:11337 --kubeconfig=/home/runner/admin.conf --namespace=egressip-9947 exec e2e-egressip-pod-2 -- curl --connect-timeout 2 172.18.0.5:80'
Oct  7 15:44:32.609: INFO: rc: 28
Oct  7 15:44:33.478: INFO: Running '/usr/local/bin/kubectl --server=https://10.1.1.167:11337 --kubeconfig=/home/runner/admin.conf --namespace=egressip-9947 exec e2e-egressip-pod-2 -- curl --connect-timeout 2 172.18.0.5:80'
Oct  7 15:44:35.609: INFO: rc: 28
Oct  7 15:44:36.477: INFO: Running '/usr/local/bin/kubectl --server=https://10.1.1.167:11337 --kubeconfig=/home/runner/admin.conf --namespace=egressip-9947 exec e2e-egressip-pod-2 -- curl --connect-timeout 2 172.18.0.5:80'
Oct  7 15:44:38.623: INFO: rc: 28
Oct  7 15:44:39.478: INFO: Running '/usr/local/bin/kubectl --server=https://10.1.1.167:11337 --kubeconfig=/home/runner/admin.conf --namespace=egressip-9947 exec e2e-egressip-pod-2 -- curl --connect-timeout 2 172.18.0.5:80'
Oct  7 15:44:41.639: INFO: rc: 28
Oct  7 15:44:41.639: INFO: Running '/usr/local/bin/kubectl --server=https://10.1.1.167:11337 --kubeconfig=/home/runner/admin.conf --namespace=egressip-9947 exec e2e-egressip-pod-2 -- curl --connect-timeout 2 172.18.0.5:80'
Oct  7 15:44:43.836: INFO: rc: 28
Oct  7 15:44:43.837: FAIL: Step 8. Check connectivity from that one to an external "node" and verify that the IP is the node IP, failed, err: timed out waiting for the condition
Unexpected error:
    <*errors.errorString | 0xc000357140>: {
        s: "timed out waiting for the condition",
    }
    timed out waiting for the condition
occurred

Full Stack Trace
github.com/ovn-org/ovn-kubernetes/test/e2e.glob..func5.9()
	/home/runner/work/ovn-kubernetes/ovn-kubernetes/test/e2e/e2e.go:1126 +0x1665
github.com/onsi/ginkgo/internal/leafnodes.(*runner).runSync(0xc0003f6780, 0x0, 0x0, 0x0, 0x0, 0x0, 0x0, 0x0, 0x0, 0x0, ...)
	/home/runner/go/pkg/mod/github.com/onsi/ginkgo@v1.14.0/internal/leafnodes/runner.go:113 +0xa3
github.com/onsi/ginkgo/internal/leafnodes.(*runner).run(0xc0003f6780, 0x0, 0x0, 0x0, 0x0, 0x0, 0x0, 0x0, 0x0, 0x0, ...)
	/home/runner/go/pkg/mod/github.com/onsi/ginkgo@v1.14.0/internal/leafnodes/runner.go:64 +0x15c
github.com/onsi/ginkgo/internal/leafnodes.(*ItNode).Run(0xc0003b2240, 0x1f9d680, 0x0, 0x0, 0x0, 0x0, 0x0, 0x0, 0x0, 0x0, ...)
	/home/runner/go/pkg/mod/github.com/onsi/ginkgo@v1.14.0/internal/leafnodes/it_node.go:26 +0x87
github.com/onsi/ginkgo/internal/spec.(*Spec).runSample(0xc000423a40, 0x0, 0x1f9d680, 0xc00016c800)
	/home/runner/go/pkg/mod/github.com/onsi/ginkgo@v1.14.0/internal/spec/spec.go:215 +0x72f
github.com/onsi/ginkgo/internal/spec.(*Spec).Run(0xc000423a40, 0x1f9d680, 0xc00016c800)
	/home/runner/go/pkg/mod/github.com/onsi/ginkgo@v1.14.0/internal/spec/spec.go:138 +0xf2
github.com/onsi/ginkgo/internal/specrunner.(*SpecRunner).runSpec(0xc0004672c0, 0xc000423a40, 0x0)
	/home/runner/go/pkg/mod/github.com/onsi/ginkgo@v1.14.0/internal/specrunner/spec_runner.go:200 +0x111
github.com/onsi/ginkgo/internal/specrunner.(*SpecRunner).runSpecs(0xc0004672c0, 0x1)
	/home/runner/go/pkg/mod/github.com/onsi/ginkgo@v1.14.0/internal/specrunner/spec_runner.go:170 +0x147
github.com/onsi/ginkgo/internal/specrunner.(*SpecRunner).Run(0xc0004672c0, 0xc0006d6150)
	/home/runner/go/pkg/mod/github.com/onsi/ginkgo@v1.14.0/internal/specrunner/spec_runner.go:66 +0x117
github.com/onsi/ginkgo/internal/suite.(*Suite).Run(0xc000194070, 0x7f83202f2e68, 0xc000103e00, 0x1d69a01, 0x9, 0xc00015a940, 0x2, 0x2, 0x1fddb78, 0xc00016c800, ...)
	/home/runner/go/pkg/mod/github.com/onsi/ginkgo@v1.14.0/internal/suite/suite.go:79 +0x546
github.com/onsi/ginkgo.RunSpecsWithCustomReporters(0x1f9fc60, 0xc000103e00, 0x1d69a01, 0x9, 0xc00015a920, 0x2, 0x2, 0x2)
	/home/runner/go/pkg/mod/github.com/onsi/ginkgo@v1.14.0/ginkgo_dsl.go:219 +0x218
github.com/onsi/ginkgo.RunSpecsWithDefaultAndCustomReporters(0x1f9fc60, 0xc000103e00, 0x1d69a01, 0x9, 0xc0004634a0, 0x1, 0x1, 0x1)
	/home/runner/go/pkg/mod/github.com/onsi/ginkgo@v1.14.0/ginkgo_dsl.go:207 +0xad
github.com/ovn-org/ovn-kubernetes/test/e2e.TestE2e(0xc000103e00)
	/home/runner/work/ovn-kubernetes/ovn-kubernetes/test/e2e/e2e_suite_test.go:71 +0xf5
testing.tRunner(0xc000103e00, 0x1e36e20)
	/opt/hostedtoolcache/go/1.16.3/x64/src/testing/testing.go:1193 +0xef
created by testing.(*T).Run
	/opt/hostedtoolcache/go/1.16.3/x64/src/testing/testing.go:1238 +0x2b3
[AfterEach] e2e egress IP validation
  /home/runner/go/pkg/mod/k8s.io/kubernetes@v1.22.2/test/e2e/framework/framework.go:186
STEP: Collecting events from namespace "egressip-9947".
STEP: Found 7 events.
~~~

I tested this 20 times in my env, with the same patch, and did not get the same result:
~~~
[root@ovnkubernetes test]# for i in {1..20} ; do echo ========= ; date ; echo =======;  make control-plane WHAT="Should validate the egress IP functionality against remote hosts" &>> /root/validate.log; tail -n 5 /root/validate.log; done
=========
Thu Oct  7 20:04:54 UTC 2021
=======
--- PASS: TestE2e (32.22s)
PASS
ok  	github.com/ovn-org/ovn-kubernetes/test/e2e	32.244s
+ popd
~/ovn-kubernetes/test
=========
Thu Oct  7 20:05:29 UTC 2021
=======
--- PASS: TestE2e (38.23s)
PASS
ok  	github.com/ovn-org/ovn-kubernetes/test/e2e	38.252s
+ popd
~/ovn-kubernetes/test
=========
Thu Oct  7 20:06:09 UTC 2021
=======
--- PASS: TestE2e (35.59s)
PASS
ok  	github.com/ovn-org/ovn-kubernetes/test/e2e	35.609s
+ popd
~/ovn-kubernetes/test
=========
Thu Oct  7 20:06:47 UTC 2021
=======
--- PASS: TestE2e (38.62s)
PASS
ok  	github.com/ovn-org/ovn-kubernetes/test/e2e	38.646s
+ popd
~/ovn-kubernetes/test
=========
Thu Oct  7 20:07:28 UTC 2021
=======
--- PASS: TestE2e (41.79s)
PASS
ok  	github.com/ovn-org/ovn-kubernetes/test/e2e	41.817s
+ popd
~/ovn-kubernetes/test
=========
Thu Oct  7 20:08:12 UTC 2021
=======
--- PASS: TestE2e (40.26s)
PASS
ok  	github.com/ovn-org/ovn-kubernetes/test/e2e	40.284s
+ popd
~/ovn-kubernetes/test
=========
Thu Oct  7 20:08:54 UTC 2021
=======
--- PASS: TestE2e (39.44s)
PASS
ok  	github.com/ovn-org/ovn-kubernetes/test/e2e	39.455s
+ popd
~/ovn-kubernetes/test
=========
Thu Oct  7 20:09:36 UTC 2021
=======
--- PASS: TestE2e (39.93s)
PASS
ok  	github.com/ovn-org/ovn-kubernetes/test/e2e	39.947s
+ popd
~/ovn-kubernetes/test
=========
Thu Oct  7 20:10:18 UTC 2021
=======
--- PASS: TestE2e (36.22s)
PASS
ok  	github.com/ovn-org/ovn-kubernetes/test/e2e	36.245s
+ popd
~/ovn-kubernetes/test
=========
Thu Oct  7 20:10:57 UTC 2021
=======
--- PASS: TestE2e (46.50s)
PASS
ok  	github.com/ovn-org/ovn-kubernetes/test/e2e	46.522s
+ popd
~/ovn-kubernetes/test
=========
Thu Oct  7 20:11:46 UTC 2021
=======
--- PASS: TestE2e (39.08s)
PASS
ok  	github.com/ovn-org/ovn-kubernetes/test/e2e	39.102s
+ popd
~/ovn-kubernetes/test
=========
Thu Oct  7 20:12:28 UTC 2021
=======
--- PASS: TestE2e (40.20s)
PASS
ok  	github.com/ovn-org/ovn-kubernetes/test/e2e	40.228s
+ popd
~/ovn-kubernetes/test
=========
Thu Oct  7 20:13:10 UTC 2021
=======
--- PASS: TestE2e (36.34s)
PASS
ok  	github.com/ovn-org/ovn-kubernetes/test/e2e	36.365s
+ popd
~/ovn-kubernetes/test
=========
Thu Oct  7 20:13:49 UTC 2021
=======
--- PASS: TestE2e (38.18s)
PASS
ok  	github.com/ovn-org/ovn-kubernetes/test/e2e	38.197s
+ popd
~/ovn-kubernetes/test
=========
Thu Oct  7 20:14:29 UTC 2021
=======
--- PASS: TestE2e (37.43s)
PASS
ok  	github.com/ovn-org/ovn-kubernetes/test/e2e	37.454s
+ popd
~/ovn-kubernetes/test
=========
Thu Oct  7 20:15:09 UTC 2021
=======
--- PASS: TestE2e (35.98s)
PASS
ok  	github.com/ovn-org/ovn-kubernetes/test/e2e	36.003s
+ popd
~/ovn-kubernetes/test
=========
Thu Oct  7 20:15:47 UTC 2021
=======
--- PASS: TestE2e (44.75s)
PASS
ok  	github.com/ovn-org/ovn-kubernetes/test/e2e	44.768s
+ popd
~/ovn-kubernetes/test
=========
Thu Oct  7 20:16:34 UTC 2021
=======
--- PASS: TestE2e (32.60s)
PASS
ok  	github.com/ovn-org/ovn-kubernetes/test/e2e	32.625s
+ popd
~/ovn-kubernetes/test
=========
Thu Oct  7 20:17:09 UTC 2021
=======
--- PASS: TestE2e (41.76s)
PASS
ok  	github.com/ovn-org/ovn-kubernetes/test/e2e	41.784s
+ popd
~/ovn-kubernetes/test
=========
Thu Oct  7 20:17:53 UTC 2021
=======
--- PASS: TestE2e (41.00s)
PASS
ok  	github.com/ovn-org/ovn-kubernetes/test/e2e	41.023s
+ popd
~/ovn-kubernetes/test
~~~

~~~
[root@ovnkubernetes ovn-kubernetes]# grep -i 'timed out' /root/validate.log
[root@ovnkubernetes ovn-kubernetes]# 
~~~

Hence, the test might have timed out, only once, in the test pipeline.

**Comment by andreaskaris** [comment]
There's the same here, too, in another test: https://pipelines.actions.githubusercontent.com/rx2q6cyVnb1KdY24EzqfkXItIKb3SzT55t8LHdEU6zlqA0chrw/_apis/pipelines/1/runs/50350/signedlogcontent/43?urlExpires=2021-10-08T20%3A56%3A34.5553956Z&urlSigningMethod=HMACV1&urlSignature=fnJUO%2BhzYIvTazj%2BvaUpfMhnQa9RP2%2B5G7Wf014Zgdc%3D

**Comment by trozet** [comment]
I see it here as well https://github.com/ovn-org/ovn-kubernetes/pull/2554/checks?check_run_id=3842284936

**Comment by trozet** [comment]
@alexanderConstantinescu @girishmg FYI

**Comment by andreaskaris** [comment]
I modified the code a bit and had the test run 20 times in my lab + I added a tcpdump and ip neigh / ip arp to the test scenario.
~~~
[root@ovnkubernetes ovn-kubernetes]# git diff 70996d91
diff --git a/.github/workflows/test.yml b/.github/workflows/test.yml
index fdabe392..7d6e8423 100644
--- a/.github/workflows/test.yml
+++ b/.github/workflows/test.yml
@@ -249,14 +249,20 @@ jobs:
       matrix:
         target:
             # hybrid-overlay = multicast-enable = emptylb-enable = false
-          - "shard-conformance"
+            ###          - "shard-conformance"
             # hybrid-overlay = multicast-enable = emptylb-enable = true
           - "control-plane"
-        ha: ["HA", "noHA"]
-        disable-snat-multiple-gws: ["noSnatGW", "snatGW"]
-        gateway-mode: ["local", "shared"]
-        second-bridge: ["2br", "1br"]
-        ipfamily: ["ipv4", "ipv6", "dualstack"]
+            ####ha: ["HA", "noHA"]
+        ha: ["noHA"]
+        #disable-snat-multiple-gws: ["noSnatGW", "snatGW"]
+        disable-snat-multiple-gws: ["snatGW"]
+        #gateway-mode: ["local", "shared"]
+        gateway-mode: ["local"]
+        #second-bridge: ["2br", "1br"]
+        second-bridge: ["1br"]
+        #ipfamily: ["ipv4", "ipv6", "dualstack"]
+        ipfamily: ["ipv4"]
+        run: [0, 1, 2, 3, 4, 5, 6, 7 , 8, 9, 10, 11, 12, 13, 14, 15, 16, 17, 18, 19, 20]
         # Example of how to exclude a fully qualified test:
         # - {"ipfamily": "ipv4"}, "ha": "HA", "gateway-mode": "shared", "target": "control-plane"}
         exclude:
@@ -292,6 +298,7 @@ jobs:
       OVN_SECOND_BRIDGE: "${{ matrix.second-bridge == '2br' }}"
       KIND_IPV4_SUPPORT: "${{ matrix.ipfamily == 'IPv4' || matrix.ipfamily == 'dualstack' }}"
       KIND_IPV6_SUPPORT: "${{ matrix.ipfamily == 'IPv6' || matrix.ipfamily == 'dualstack' }}"
+      RUN_NUMBER: "${{ matrix.run }}"
     steps:
 
     - name: Free up disk space
diff --git a/test/e2e/e2e.go b/test/e2e/e2e.go
index 47590320..1212dd5f 100644
--- a/test/e2e/e2e.go
+++ b/test/e2e/e2e.go
@@ -284,6 +284,52 @@ func createServiceForPodsWithLabel(f *framework.Framework, namespace string, ser
        return res.Spec.ClusterIP, nil
 }
 
+func installDebugCmdDeps(containerName string) {
+       args := []string{
+               "docker",
+               "exec",
+               containerName,
+               "/bin/bash",
+               "-c",
+               "apt-get update && apt-get install tcpdump -y && apt-get install iproute2 -y",
+       }
+
+       output, err := runCommand(args...)
+       if err != nil {
+               framework.Logf("Error running command %c:\n%v", args, err)
+               return
+       }
+       framework.Logf("Result of command %c:\n%v", args, output)
+}
+
+func debugCmd(containerName string, stop chan bool) {
+       args := []string{
+               "docker",
+               "exec",
+               containerName,
+               "/bin/bash",
+               "-c",
+               "ip a && ip n && timeout 2 tcpdump -nnei eth0",
+       }
+
+       framework.Logf("Started debugCmd with args %v", args)
+
+       for {
+               select {
+               case _ = <-stop:
+                       return
+               default:
+                       time.Sleep(10 * time.Millisecond)
+                       output, err := runCommand(args...)
+                       if err != nil {
+                               framework.Logf("Error running command %v:\n%v", args, err)
+                               continue
+                       }
+                       framework.Logf("Result of command %v:\n%v", args, output)
+               }
+       }
+}
+
 func createClusterExternalContainer(containerName string, containerImage string, dockerArgs []string, entrypointArgs []string) (string, string) {
        args := []string{"docker", "run", "-itd"}
        args = append(args, dockerArgs...)
@@ -686,7 +732,7 @@ var _ = ginkgo.Describe("test e2e pod connectivity to host addresses", func() {
 
        f := framework.NewDefaultFramework(svcname)
 
-       ginkgo.BeforeEach(func(){
+       ginkgo.BeforeEach(func() {
                targetIP = "123.123.123.123"
                singleIPMask = "32"
                if IsIPv6Cluster(f.ClientSet) {
@@ -893,7 +939,9 @@ var _ = ginkgo.Describe("e2e egress IP validation", func() {
                        lastLine := logLines[len(logLines)-1]
                        for i := 0; i < len(verifyIPs); i++ {
                                if strings.Contains(lastLine, verifyIPs[i]) {
+                                       framework.Logf("the test external container contains a trace of IP: %v, removing it from the slice", verifyIPs[i])
                                        verifyIPs = removeSliceElement(verifyIPs, i)
+                                       framework.Logf("outstanding IPs: %v, last log line with match: %s", verifyIPs, lastLine)
                                        break
                                }
                        }
@@ -905,6 +953,7 @@ var _ = ginkgo.Describe("e2e egress IP validation", func() {
                                framework.Logf("the test external container did have a trace of the IPs: %v being logged, it should not have, last logs: %s", verifyIPs, logLines[len(logLines)-1])
                                return false, nil
                        }
+
                        return true, nil
                }
        }
@@ -1103,6 +1152,9 @@ spec:
 
                pod2IP := getPodAddress(pod2Name, f.Namespace.Name)
                ginkgo.By("4. Check connectivity from both to an external \"node\" and verify that the IPs are both of the above")
+               stop := make(chan bool)
+               installDebugCmdDeps(targetNode.name)
+               go debugCmd(targetNode.name, stop)
                err = wait.PollImmediate(retryInterval, retryTimeout, targetExternalContainerAndTest(targetNode, pod1Name, podNamespace.Name, true, []string{egressIP1.String(), egressIP2.String()}))
                framework.ExpectNoError(err, "Step 4. Check connectivity from first to an external \"node\" and verify that the IPs are both of the above, failed: %v", err)
                err = wait.PollImmediate(retryInterval, retryTimeout, targetExternalContainerAndTest(targetNode, pod2Name, podNamespace.Name, true, []string{egressIP1.String(), egressIP2.String()}))
@@ -1124,6 +1176,7 @@ spec:
                ginkgo.By("8. Check connectivity from that one to an external \"node\" and verify that the IP is the node IP.")
                err = wait.PollImmediate(retryInterval, retryTimeout, targetExternalContainerAndTest(targetNode, pod2Name, podNamespace.Name, true, []string{pod2Node.nodeIP}))
                framework.ExpectNoError(err, "Step 8. Check connectivity from that one to an external \"node\" and verify that the IP is the node IP, failed, err: %v", err)
+               stop <- true
 
                ginkgo.By("9. Check connectivity from the other one to an external \"node\" and verify that the IPs are both of the above")
                err = wait.PollImmediate(retryInterval, retryTimeout, targetExternalContainerAndTest(targetNode, pod1Name, podNamespace.Name, true, []string{egressIP1.String(), egressIP2.String()}))
~~~

In the failing scenarios, the SNAT is broken and the packets arrive without being NATed:
https://github.com/andreaskaris/ovn-kubernetes/runs/3844208209?check_suite_focus=true

I still cannot reproduce this in my own environment though, but at least the above gets some more insight into what's happening.
The question is why this would only happen once every x tests and why I cannot replicate this in my lab ... -_-

Here is the working test 6. before the Egress IP feature is being removed:
~~~
2021-10-09T01:22:57.2079261Z [1mSTEP[0m: 6. Check connectivity from both pods to the api-server (running hostNetwork:true) and verifying that the connection is achieved
2021-10-09T01:22:57.2080937Z Oct  9 01:22:57.207: INFO: Running '/usr/local/bin/kubectl --server=https://10.1.0.5:11337 --kubeconfig=/home/runner/admin.conf --namespace=default get svc kubernetes -o jsonpath='{.spec.clusterIP}''
2021-10-09T01:22:57.2615939Z Oct  9 01:22:57.261: INFO: stderr: ""
2021-10-09T01:22:57.2618071Z Oct  9 01:22:57.261: INFO: stdout: "'10.96.0.1'"
2021-10-09T01:22:57.2621629Z Oct  9 01:22:57.261: INFO: Running '/usr/local/bin/kubectl --server=https://10.1.0.5:11337 --kubeconfig=/home/runner/admin.conf --namespace=egressip-694 exec e2e-egressip-pod-1 -- curl --connect-timeout 2 -k https://10.96.0.1:443/version'
2021-10-09T01:22:57.4186604Z Oct  9 01:22:57.418: INFO: stderr: "  % Total    % Received % Xferd  Average Speed   Time    Time     Time  Current\n                                 Dload  Upload   Total   Spent    Left  Speed\n\r  0     0    0     0    0     0      0      0 --:--:-- --:--:-- --:--:--     0\r100   263  100   263    0     0  17533      0 --:--:-- --:--:-- --:--:-- 17533\n"
2021-10-09T01:22:57.4189194Z Oct  9 01:22:57.418: INFO: stdout: "{\n  \"major\": \"1\",\n  \"minor\": \"20\",\n  \"gitVersion\": \"v1.20.2\",\n  \"gitCommit\": \"faecb196815e248d3ecfb03c680a4507229c2a56\",\n  \"gitTreeState\": \"clean\",\n  \"buildDate\": \"2021-03-11T06:23:38Z\",\n  \"goVersion\": \"go1.15.5\",\n  \"compiler\": \"gc\",\n  \"platform\": \"linux/amd64\"\n}"
2021-10-09T01:22:57.4192549Z Oct  9 01:22:57.418: INFO: Running '/usr/local/bin/kubectl --server=https://10.1.0.5:11337 --kubeconfig=/home/runner/admin.conf --namespace=egressip-694 exec e2e-egressip-pod-2 -- curl --connect-timeout 2 -k https://10.96.0.1:443/version'
2021-10-09T01:22:57.4931528Z Oct  9 01:22:57.492: INFO: Error running command [docker exec egressTargetNode-allowed /bin/bash -c ip a && ip n && timeout 2 tcpdump -nnei eth0]:
2021-10-09T01:22:57.4933945Z failed to run "docker exec egressTargetNode-allowed /bin/bash -c ip a && ip n && timeout 2 tcpdump -nnei eth0": exit status 124 (1: lo: <LOOPBACK,UP,LOWER_UP> mtu 65536 qdisc noqueue state UNKNOWN group default qlen 1000
2021-10-09T01:22:57.4935046Z     link/loopback 00:00:00:00:00:00 brd 00:00:00:00:00:00
2021-10-09T01:22:57.4935485Z     inet 127.0.0.1/8 scope host lo
2021-10-09T01:22:57.4935986Z        valid_lft forever preferred_lft forever
2021-10-09T01:22:57.4936578Z     inet6 ::1/128 scope host 
2021-10-09T01:22:57.4937089Z        valid_lft forever preferred_lft forever
2021-10-09T01:22:57.4937885Z 13: eth0@if14: <BROADCAST,MULTICAST,UP,LOWER_UP> mtu 1500 qdisc noqueue state UP group default 
2021-10-09T01:22:57.4938927Z     link/ether 02:42:ac:12:00:05 brd ff:ff:ff:ff:ff:ff link-netnsid 0
2021-10-09T01:22:57.4939481Z     inet 172.18.0.5/16 brd 172.18.255.255 scope global eth0
2021-10-09T01:22:57.4940085Z        valid_lft forever preferred_lft forever
2021-10-09T01:22:57.4940651Z     inet6 fc00:f853:ccd:e793::5/64 scope global nodad 
2021-10-09T01:22:57.4941188Z        valid_lft forever preferred_lft forever
2021-10-09T01:22:57.4941884Z     inet6 fe80::42:acff:fe12:5/64 scope link 
2021-10-09T01:22:57.4942415Z        valid_lft forever preferred_lft forever
2021-10-09T01:22:57.4942929Z 172.18.1.3 dev eth0 lladdr 02:42:ac:12:00:03 REACHABLE
2021-10-09T01:22:57.4943427Z 172.18.1.4 dev eth0 lladdr 02:42:ac:12:00:04 REACHABLE
2021-10-09T01:22:57.4943893Z 172.18.0.1 dev eth0 lladdr 02:42:9b:65:08:92 STALE
2021-10-09T01:22:57.4944541Z 172.18.0.3 dev eth0 lladdr 02:42:ac:12:00:03 STALE
2021-10-09T01:22:57.4945002Z 172.18.0.4 dev eth0 lladdr 02:42:ac:12:00:04 STALE
2021-10-09T01:22:57.4945835Z tcpdump: verbose output suppressed, use -v or -vv for full protocol decode
2021-10-09T01:22:57.4946750Z listening on eth0, link-type EN10MB (Ethernet), capture size 262144 bytes
2021-10-09T01:22:57.4947590Z 01:22:55.555205 02:42:ac:12:00:06 > 33:33:00:00:00:02, ethertype IPv6 (0x86dd), length 70: fe80::42:acff:fe12:6 > ff02::2: ICMP6, router solicitation, length 16
2021-10-09T01:22:57.4948571Z 01:22:55.686250 02:42:ac:12:00:04 > 02:42:ac:12:00:05, ethertype IPv4 (0x0800), length 74: 172.18.1.4.35316 > 172.18.0.5.80: Flags [S], seq 4259168209, win 65280, options [mss 1360,sackOK,TS val 2909522676 ecr 0,nop,wscale 7], length 0
2021-10-09T01:22:57.4949964Z 01:22:55.686277 02:42:ac:12:00:05 > 02:42:ac:12:00:04, ethertype IPv4 (0x0800), length 74: 172.18.0.5.80 > 172.18.1.4.35316: Flags [S.], seq 33380060, ack 4259168210, win 65160, options [mss 1460,sackOK,TS val 1469755672 ecr 2909522676,nop,wscale 7], length 0
2021-10-09T01:22:57.4950966Z 01:22:55.686897 02:42:ac:12:00:04 > 02:42:ac:12:00:05, ethertype IPv4 (0x0800), length 66: 172.18.1.4.35316 > 172.18.0.5.80: Flags [.], ack 1, win 510, options [nop,nop,TS val 2909522677 ecr 1469755672], length 0
2021-10-09T01:22:57.4952870Z 01:22:55.686915 02:42:ac:12:00:04 > 02:42:ac:12:00:05, ethertype IPv4 (0x0800), length 140: 172.18.1.4.35316 > 172.18.0.5.80: Flags [P.], seq 1:75, ack 1, win 510, options [nop,nop,TS val 2909522677 ecr 1469755672], length 74: HTTP: GET / HTTP/1.1
2021-10-09T01:22:57.4953928Z 01:22:55.686934 02:42:ac:12:00:05 > 02:42:ac:12:00:04, ethertype IPv4 (0x0800), length 66: 172.18.0.5.80 > 172.18.1.4.35316: Flags [.], ack 75, win 509, options [nop,nop,TS val 1469755673 ecr 2909522677], length 0
2021-10-09T01:22:57.4955719Z 01:22:55.687215 02:42:ac:12:00:05 > 02:42:ac:12:00:04, ethertype IPv4 (0x0800), length 336: 172.18.0.5.80 > 172.18.1.4.35316: Flags [P.], seq 1:271, ack 75, win 509, options [nop,nop,TS val 1469755673 ecr 2909522677], length 270: HTTP: HTTP/1.1 200 OK
2021-10-09T01:22:57.4956694Z 01:22:55.687298 02:42:ac:12:00:04 > 02:42:ac:12:00:05, ethertype IPv4 (0x0800), length 66: 172.18.1.4.35316 > 172.18.0.5.80: Flags [.], ack 271, win 508, options [nop,nop,TS val 2909522678 ecr 1469755673], length 0
2021-10-09T01:22:57.4957630Z 01:22:55.687602 02:42:ac:12:00:04 > 02:42:ac:12:00:05, ethertype IPv4 (0x0800), length 66: 172.18.1.4.35316 > 172.18.0.5.80: Flags [F.], seq 75, ack 271, win 508, options [nop,nop,TS val 2909522679 ecr 1469755673], length 0
2021-10-09T01:22:57.4958579Z 01:22:55.687717 02:42:ac:12:00:05 > 02:42:ac:12:00:04, ethertype IPv4 (0x0800), length 66: 172.18.0.5.80 > 172.18.1.4.35316: Flags [F.], seq 271, ack 76, win 509, options [nop,nop,TS val 1469755674 ecr 2909522679], length 0
2021-10-09T01:22:57.4959512Z 01:22:55.687816 02:42:ac:12:00:04 > 02:42:ac:12:00:05, ethertype IPv4 (0x0800), length 66: 172.18.1.4.35316 > 172.18.0.5.80: Flags [.], ack 272, win 508, options [nop,nop,TS val 2909522679 ecr 1469755674], length 0
2021-10-09T01:22:57.4960482Z 01:22:55.860027 02:42:ac:12:00:04 > 02:42:ac:12:00:05, ethertype IPv4 (0x0800), length 74: 172.18.1.4.59956 > 172.18.0.5.80: Flags [S], seq 257405980, win 65280, options [mss 1360,sackOK,TS val 1116111249 ecr 0,nop,wscale 7], length 0
2021-10-09T01:22:57.4961509Z 01:22:55.860051 02:42:ac:12:00:05 > 02:42:ac:12:00:04, ethertype IPv4 (0x0800), length 74: 172.18.0.5.80 > 172.18.1.4.59956: Flags [S.], seq 1554561437, ack 257405981, win 65160, options [mss 1460,sackOK,TS val 1469755846 ecr 1116111249,nop,wscale 7], length 0
2021-10-09T01:22:57.4962489Z 01:22:55.868408 02:42:ac:12:00:04 > 02:42:ac:12:00:05, ethertype IPv4 (0x0800), length 66: 172.18.1.4.59956 > 172.18.0.5.80: Flags [.], ack 1, win 510, options [nop,nop,TS val 1116111253 ecr 1469755846], length 0
2021-10-09T01:22:57.4973771Z 01:22:55.870668 02:42:ac:12:00:04 > 02:42:ac:12:00:05, ethertype IPv4 (0x0800), length 140: 172.18.1.4.59956 > 172.18.0.5.80: Flags [P.], seq 1:75, ack 1, win 510, options [nop,nop,TS val 1116111262 ecr 1469755846], length 74: HTTP: GET / HTTP/1.1
2021-10-09T01:22:57.4975016Z 01:22:55.870688 02:42:ac:12:00:05 > 02:42:ac:12:00:04, ethertype IPv4 (0x0800), length 66: 172.18.0.5.80 > 172.18.1.4.59956: Flags [.], ack 75, win 509, options [nop,nop,TS val 1469755857 ecr 1116111262], length 0
2021-10-09T01:22:57.4976297Z 01:22:55.870914 02:42:ac:12:00:05 > 02:42:ac:12:00:04, ethertype IPv4 (0x0800), length 336: 172.18.0.5.80 > 172.18.1.4.59956: Flags [P.], seq 1:271, ack 75, win 509, options [nop,nop,TS val 1469755857 ecr 1116111262], length 270: HTTP: HTTP/1.1 200 OK
2021-10-09T01:22:57.4977566Z 01:22:55.871461 02:42:ac:12:00:04 > 02:42:ac:12:00:05, ethertype IPv4 (0x0800), length 66: 172.18.1.4.59956 > 172.18.0.5.80: Flags [.], ack 271, win 508, options [nop,nop,TS val 1116111262 ecr 1469755857], length 0
2021-10-09T01:22:57.4978875Z 01:22:55.871614 02:42:ac:12:00:04 > 02:42:ac:12:00:05, ethertype IPv4 (0x0800), length 66: 172.18.1.4.59956 > 172.18.0.5.80: Flags [F.], seq 75, ack 271, win 508, options [nop,nop,TS val 1116111263 ecr 1469755857], length 0
2021-10-09T01:22:57.4979998Z 01:22:55.871699 02:42:ac:12:00:05 > 02:42:ac:12:00:04, ethertype IPv4 (0x0800), length 66: 172.18.0.5.80 > 172.18.1.4.59956: Flags [F.], seq 271, ack 76, win 509, options [nop,nop,TS val 1469755858 ecr 1116111263], length 0
2021-10-09T01:22:57.4981015Z 01:22:55.871742 02:42:ac:12:00:04 > 02:42:ac:12:00:05, ethertype IPv4 (0x0800), length 66: 172.18.1.4.59956 > 172.18.0.5.80: Flags [.], ack 272, win 508, options [nop,nop,TS val 1116111263 ecr 1469755858], length 0
2021-10-09T01:22:57.4981526Z 
2021-10-09T01:22:57.4981874Z 21 packets captured
2021-10-09T01:22:57.4982296Z 34 packets received by filter
2021-10-09T01:22:57.4982943Z 0 packets dropped by kernel
~~~

Here is the breaking test:
~~~
2021-10-09T01:24:12.9646367Z [1mSTEP[0m: 7. Update one of the pods, unmatching the EgressIP
2021-10-09T01:24:12.9647541Z [1mSTEP[0m: 8. Check connectivity from that one to an external "node" and verify that the IP is the node IP.
2021-10-09T01:24:12.9649293Z Oct  9 01:24:12.412: INFO: Running '/usr/local/bin/kubectl --server=https://10.1.0.5:11337 --kubeconfig=/home/runner/admin.conf --namespace=egressip-3274 exec e2e-egressip-pod-2 -- curl --connect-timeout 2 172.18.0.5:80'
2021-10-09T01:24:14.0660962Z Oct  9 01:24:14.065: INFO: Error running command [docker exec egressTargetNode-allowed /bin/bash -c ip a && ip n && timeout 2 tcpdump -nnei eth0]:
2021-10-09T01:24:14.0662861Z failed to run "docker exec egressTargetNode-allowed /bin/bash -c ip a && ip n && timeout 2 tcpdump -nnei eth0": exit status 124 (1: lo: <LOOPBACK,UP,LOWER_UP> mtu 65536 qdisc noqueue state UNKNOWN group default qlen 1000
2021-10-09T01:24:14.0664089Z     link/loopback 00:00:00:00:00:00 brd 00:00:00:00:00:00
2021-10-09T01:24:14.0664518Z     inet 127.0.0.1/8 scope host lo
2021-10-09T01:24:14.0665025Z        valid_lft forever preferred_lft forever
2021-10-09T01:24:14.0665550Z     inet6 ::1/128 scope host 
2021-10-09T01:24:14.0666023Z        valid_lft forever preferred_lft forever
2021-10-09T01:24:14.0666947Z 17: eth0@if18: <BROADCAST,MULTICAST,UP,LOWER_UP> mtu 1500 qdisc noqueue state UP group default 
2021-10-09T01:24:14.0667963Z     link/ether 02:42:ac:12:00:05 brd ff:ff:ff:ff:ff:ff link-netnsid 0
2021-10-09T01:24:14.0668535Z     inet 172.18.0.5/16 brd 172.18.255.255 scope global eth0
2021-10-09T01:24:14.0669061Z        valid_lft forever preferred_lft forever
2021-10-09T01:24:14.0669598Z     inet6 fc00:f853:ccd:e793::5/64 scope global nodad 
2021-10-09T01:24:14.0670143Z        valid_lft forever preferred_lft forever
2021-10-09T01:24:14.0670650Z     inet6 fe80::42:acff:fe12:5/64 scope link 
2021-10-09T01:24:14.0671260Z        valid_lft forever preferred_lft forever
2021-10-09T01:24:14.0671904Z 172.18.1.3 dev eth0 lladdr 02:42:ac:12:00:03 REACHABLE
2021-10-09T01:24:14.0672389Z 172.18.1.4 dev eth0 lladdr 02:42:ac:12:00:04 REACHABLE
2021-10-09T01:24:14.0672872Z 172.18.0.1 dev eth0 lladdr 02:42:9b:65:08:92 REACHABLE
2021-10-09T01:24:14.0673672Z tcpdump: verbose output suppressed, use -v or -vv for full protocol decode
2021-10-09T01:24:14.0674585Z listening on eth0, link-type EN10MB (Ethernet), capture size 262144 bytes
2021-10-09T01:24:14.0675480Z 01:24:12.622299 02:42:ac:12:00:04 > 02:42:ac:12:00:05, ethertype IPv4 (0x0800), length 74: 10.244.1.7.50168 > 172.18.0.5.80: Flags [S], seq 87925316, win 65280, options [mss 1360,sackOK,TS val 340314296 ecr 0,nop,wscale 7], length 0
2021-10-09T01:24:14.0676514Z 01:24:12.622325 02:42:ac:12:00:05 > 02:42:9b:65:08:92, ethertype IPv4 (0x0800), length 74: 172.18.0.5.80 > 10.244.1.7.50168: Flags [S.], seq 2515914516, ack 87925317, win 65160, options [mss 1460,sackOK,TS val 3263647864 ecr 340314296,nop,wscale 7], length 0
2021-10-09T01:24:14.0677106Z 
2021-10-09T01:24:14.0677447Z 2 packets captured
2021-10-09T01:24:14.0677868Z 5 packets received by filter
2021-10-09T01:24:14.0678324Z 0 packets dropped by kernel
2021-10-09T01:24:14.0678686Z ) 
~~~

**Comment by andreaskaris** [comment]
I could recreate the issue locally. It's very random, and it can only be reproduced by deleting and reinstalling the kind cluster (for whatever reason.

~~~
[root@ovnkubernetes ovn-kubernetes]# git diff | cat
diff --git a/test/e2e/e2e.go b/test/e2e/e2e.go
index 1212dd5f..edb3b5fe 100644
--- a/test/e2e/e2e.go
+++ b/test/e2e/e2e.go
@@ -1,6 +1,7 @@
 package e2e
 
 import (
+	"runtime"
 	"context"
 	"encoding/json"
 	"fmt"
@@ -1175,6 +1176,9 @@ spec:
 
 		ginkgo.By("8. Check connectivity from that one to an external \"node\" and verify that the IP is the node IP.")
 		err = wait.PollImmediate(retryInterval, retryTimeout, targetExternalContainerAndTest(targetNode, pod2Name, podNamespace.Name, true, []string{pod2Node.nodeIP}))
+		if err != nil {
+			runtime.Breakpoint()
+		}
 		framework.ExpectNoError(err, "Step 8. Check connectivity from that one to an external \"node\" and verify that the IP is the node IP, failed, err: %v", err)
 		stop <- true
 ~~~

~~~
[root@ovnkubernetes ~]# cat script.sh 
#!/bin/bash -x

export   KIND_CLUSTER_NAME=ovn
export      KIND_INSTALL_INGRESS=true
export      KIND_ALLOW_SYSTEM_WRITES=true
export      PARALLEL=true
export     JOB_NAME=control-plane-noHA-local-ipv4-snatGW-1br
export      OVN_HYBRID_OVERLAY_ENABLE=true
export      OVN_MULTICAST_ENABLE=true
export      OVN_EMPTY_LB_EVENTS=true
export      OVN_HA=false
export      OVN_DISABLE_SNAT_MULTIPLE_GWS=false
export      OVN_GATEWAY_MODE=local
export      OVN_SECOND_BRIDGE=false
export      KIND_IPV4_SUPPORT=true
export     KIND_IPV6_SUPPORT=false

cd /root/ovn-kubernetes/contrib
./kind.sh --delete
./kind.sh

cd /root/ovn-kubernetes/test/e2e
dlv test --init <(printf continue) --  -ginkgo.v -ginkgo.focus 'Should validate the egress IP functionality against remote hosts$' -ginkgo.flakeAttempts 2 '-ginkgo.skip=Should validate connectivity before and after deleting all the db-pods at once in Non-HA mode' -provider skeleton -kubeconfig /root/admin.conf --num-nodes=2
~~~

~~~
while true ; do  ./script.sh ; done
~~~

With that, this will eventually reproduce the issue and stall at the breakpoint. Simply kill the script, then.

We can then see that the policy is not being removed when the label is taken off:
~~~
[root@ovnkubernetes ~]# oc get pods -n egressip-8081 --show-labels -o wide
NAME                 READY   STATUS    RESTARTS   AGE     IP           NODE                NOMINATED NODE   READINESS GATES   LABELS
e2e-egressip-pod-1   1/1     Running   0          3m15s   10.244.1.5   ovn-worker          <none>           <none>            wants=egress
e2e-egressip-pod-2   1/1     Running   0          3m7s    10.244.2.4   ovn-control-plane   <none>           <none>            <none>
~~~

~~~
sh-5.1# ovn-nbctl lr-policy-list ovn_cluster_router
Routing Policies
      1005 ip4.src == 10.244.0.2 && ip4.dst == 172.18.0.3 /* ovn-worker2 */         reroute               169.254.0.1
      1005 ip4.src == 10.244.1.2 && ip4.dst == 172.18.0.4 /* ovn-worker */         reroute               169.254.0.1
      1005 ip4.src == 10.244.2.2 && ip4.dst == 172.18.0.2 /* ovn-control-plane */         reroute               169.254.0.1
      1004 inport == "rtos-ovn-control-plane" && ip4.dst == 172.18.0.2 /* ovn-control-plane */         reroute                10.244.2.2
      1004 inport == "rtos-ovn-worker" && ip4.dst == 172.18.0.4 /* ovn-worker */         reroute                10.244.1.2
      1004 inport == "rtos-ovn-worker2" && ip4.dst == 172.18.0.3 /* ovn-worker2 */         reroute                10.244.0.2
      1003 ip4.src == 10.244.0.2  && ip4.dst != 10.244.0.0/16 /* inter-ovn-worker2 */         reroute               169.254.0.1
      1003 ip4.src == 10.244.1.2  && ip4.dst != 10.244.0.0/16 /* inter-ovn-worker */         reroute               169.254.0.1
      1003 ip4.src == 10.244.2.2  && ip4.dst != 10.244.0.0/16 /* inter-ovn-control-plane */         reroute               169.254.0.1
       101 ip4.src == 10.244.0.0/16 && ip4.dst == 10.244.0.0/16           allow
       101 ip4.src == 10.244.0.0/16 && ip4.dst == 172.18.0.2/32           allow
       101 ip4.src == 10.244.0.0/16 && ip4.dst == 172.18.0.3/32           allow
       101 ip4.src == 10.244.0.0/16 && ip4.dst == 172.18.0.4/32           allow
       100                              ip4.src == 10.244.1.5         reroute                100.64.0.2, 100.64.0.3
       100                              ip4.src == 10.244.2.4         reroute                100.64.0.2, 100.64.0.3
~~~

I'll now look into why that's happening.

**Comment by andreaskaris** [comment]
@tssurya I think I found it and it may be ridiculously simple, unless this here is a red herring:
~~~
                        ModelPredicate: func(lrp *nbdb.LogicalRouterPolicy) bool {
                                klog.V(5).Infof("akaris: ModelPredicate: Comparing '%v'->'%v' (result '%v')", lrp.Match, filterOption, lrp.Match == filterOption)
                                klog.V(5).Infof("akaris: ModelPredicate: Comparing '%v'->'%v' (result '%v')", lrp.Priority, types.EgressIPReroutePriority, lrp.Priority == types.EgressIPReroutePriority)
                                klog.V(5).Infof("akaris: ModelPredicate: Comparing '%v'->'%v' (result '%v')", lrp.Nexthops, gatewayRouterIPs, reflect.DeepEqual(lrp.Nexthops, gatewayRouterIPs))
                                klog.V(5).Infof("akaris: ModelPredicate: Comparing '%v'->'%v' (result '%v')", lrp.ExternalIDs["name"], egressIPName, lrp.ExternalIDs["name"] == egressIPName)
                                return lrp.Match == filterOption && lrp.Priority == types.EgressIPReroutePriority && reflect.DeepEqual(lrp.Nexthops, gatewayRouterIPs) && lrp.ExternalIDs["name"] == egressIPName
                    },
~~~

~~~
I1010 16:55:21.761315      50 egressip.go:976] akaris: ModelPredicate: Comparing 'ip4.src == 10.244.1.4'->'ip4.src == 10.244.1.4' (result 'true')
I1010 16:55:21.761324      50 egressip.go:977] akaris: ModelPredicate: Comparing '100'->'100' (result 'true')
I1010 16:55:21.761332      50 egressip.go:978] akaris: ModelPredicate: Comparing '[100.64.0.2 100.64.0.4]'->'[100.64.0.4 100.64.0.2]' (result 'false')
~~~

The model predicate's DeepEqual doesn't keep in mind that the order or endpoints may be inverted, that would also explain that this sometimes fails, sometimes works:
~~~
reflect.DeepEqual(lrp.Nexthops, gatewayRouterIPs)
~~~

If you aren't on it, let me push a fix for it and see if it resolved the issue :-)
