### ISSUE TITLE
LGW lanes flake: [Fail] Services when a nodePort service targeting a pod with hostNetwork:false

### ISSUE THREAD

**Issue by tssurya** [ovn-org/ovn-kubernetes#3419]
Since we merged https://github.com/ovn-org/ovn-kubernetes/pull/3394 we have been seeing flakes around the following tests in LGW mode:
```
Summarizing 2 Failures:

[Fail] Services when a nodePort service targeting a pod with hostNetwork:false is created when tests are run towards the agnhost echo service [It] queries to the nodePort service shall work for UDP 
/home/surya/go/src/github.com/ovn-org/ovn-kubernetes/test/e2e/service.go:349

[Fail] Services when a nodePort service targeting a pod with hostNetwork:false is created when tests are run towards the agnhost echo service [It] queries to the nodePort service shall work for UDP 
```

@trozet and I have been debugging this the past few hours. Thanks to @trozet , we know more or less what is happening here.

**Comment by tssurya** [comment]
Test case traffic flow:

`host-network client pod on ovn-worker2 ----> ovn-workerIP:nodePort svc -----> backend pod on ovn-control-plane (1st test creates a host-net backend and 2nd test creates an OVN backend). `

The reason why this flakes is because of the order in which tests are run.
The test where we create `hostNetwork:true` backend pod as the service on `ovn-control-plane` has to be run before the `hostNetwork:false` test case where we create ovn backend pods on `ovn-control-plane`.  If the second test is run by itself or run at a gap of 5 minutes after the first one, it won't fail.

**Comment by tssurya** [comment]
Debugging details:

The first test uses the new flows of 175 priority in LGW.

Large packet flow > 1400 length:

1. ovn-worker2 sends a request to nodePort
2. pkt travels to ovn-worker via underlay
3. ovn-worker dnats this to clusterIP and sends to OVN GR, we hit this route `10.96.0.0/16 via 169.254.169.4 dev breth0 mtu 1400 ` and instead of sending to OVN GR, we realise we `needFrag`
4. ovn-worker sends back ICMP frag needed to ovn-worker2 which adjusts the size of the packet and sends it back
```
13:10:33.472016 eth0  In  ifindex 288 02:42:ac:13:00:04 ethertype IPv4 (0x0800), length 1474: (tos 0x0, ttl 64, id 62514, offset 0, flags [DF], proto UDP (17), length 1454) 
    172.19.0.4.33546 > 172.19.0.2.31206: UDP, length 1426                                                                                                                    
13:10:33.472027 breth0 In  ifindex 6 02:42:ac:13:00:04 ethertype IPv4 (0x0800), length 1474: (tos 0x0, ttl 64, id 62514, offset 0, flags [DF], proto UDP (17), length 1454)  
    172.19.0.4.33546 > 172.19.0.2.31206: UDP, length 1426                                                                                                                    
13:10:33.472046 breth0 Out ifindex 6 02:42:ac:13:00:02 ethertype IPv4 (0x0800), length 596: (tos 0xc0, ttl 64, id 13905, offset 0, flags [none], proto ICMP (1), length 576) 
    172.19.0.2 > 172.19.0.4: ICMP 172.19.0.2 unreachable - need to frag (mtu 1400), length 556                                                                               
        (tos 0x0, ttl 64, id 62514, offset 0, flags [DF], proto UDP (17), length 1454)                                                                                       
    172.19.0.4.33546 > 172.19.0.2.31206: UDP, length 1426                                                                                                                    
13:10:33.472198 eth0  Out ifindex 288 02:42:ac:13:00:02 ethertype IPv4 (0x0800), length 596: (tos 0xc0, ttl 64, id 13905, offset 0, flags [none], proto ICMP (1), length 576)
    172.19.0.2 > 172.19.0.4: ICMP 172.19.0.2 unreachable - need to frag (mtu 1400), length 556                                                                               
        (tos 0x0, ttl 64, id 62514, offset 0, flags [DF], proto UDP (17), length 1454)                                                                                       
    172.19.0.4.33546 > 172.19.0.2.31206: UDP, length 1426                                                                                                                    
13:10:36.616717 eth0  In  ifindex 288 02:42:ac:13:00:04 ethertype IPv4 (0x0800), length 1416: (tos 0x0, ttl 64, id 39428, offset 0, flags [+], proto UDP (17), length 1396)  
    172.19.0.4.35853 > 172.19.0.2.31206: UDP, length 1426                                                                                                                    
13:10:36.616786 eth0  In  ifindex 288 02:42:ac:13:00:04 ethertype IPv4 (0x0800), length 98: (tos 0x0, ttl 64, id 39428, offset 1376, flags [none], proto UDP (17), length 78)
    172.19.0.4 > 172.19.0.2: ip-proto-17                                                                                                                                     
13:10:36.617304 breth0 In  ifindex 6 02:42:ac:13:00:04 ethertype IPv4 (0x0800), length 1416: (tos 0x0, ttl 64, id 39428, offset 0, flags [+], proto UDP (17), length 1396)   
    172.19.0.4.35853 > 172.19.0.2.31206: UDP, length 1426                                                                                                                    
13:10:36.617312 breth0 In  ifindex 6 02:42:ac:13:00:04 ethertype IPv4 (0x0800), length 98: (tos 0x0, ttl 64, id 39428, offset 1376, flags [none], proto UDP (17), length 78) 
    172.19.0.4 > 172.19.0.2: ip-proto-17                                                                                                                                     
13:10:36.617374 breth0 Out ifindex 6 02:42:ac:13:00:02 ethertype IPv4 (0x0800), length 1416: (tos 0x0, ttl 63, id 39428, offset 0, flags [+], proto UDP (17), length 1396)   
    172.19.0.4.35853 > 10.96.211.211.9894: UDP, length 1426                                                                                                                  
13:10:36.617428 breth0 Out ifindex 6 02:42:ac:13:00:02 ethertype IPv4 (0x0800), length 98: (tos 0x0, ttl 63, id 39428, offset 1376, flags [none], proto UDP (17), length 78)
    172.19.0.4 > 10.96.211.211: ip-proto-17                                                                                  
```
5. OVN GR dnats this to ovn-control-plane nodeIP which is the backend
6. pkt from OVN GR before my change would be sent straight out from breth0, but now they hit priority flow 175 and get sent into the host where we snat to .1 masqueradeIP before sending it to the host where we hit the `169.254.169.1 dev breth0 scope link src 172.19.0.2 mtu 1400` route before we send it back out the host via eth0.
7. pkt travels to ovn-control-plane via underlay and reply is sent back to ovn-worker
8. now the reply comes back into ovn-worker , is sent to host with mark 0x2, we unmasquerade to .1 hit the route again on the host, and we realise the pkt size is larger than 1400 and send back `needsFrag` to ovn-control-plane.
```
13:10:36.618144 breth0 In  ifindex 6 02:42:ac:13:00:03 ethertype IPv4 (0x0800), length 1416: (tos 0x0, ttl 62, id 39428, offset 0, flags [+], proto UDP (17), length 1396)
    169.254.169.1.35853 > 172.19.0.3.9894: UDP, length 1426                                                                                                                  
13:10:36.618154 breth0 In  ifindex 6 02:42:ac:13:00:03 ethertype IPv4 (0x0800), length 98: (tos 0x0, ttl 62, id 39428, offset 1376, flags [none], proto UDP (17), length 78)
    169.254.169.1 > 172.19.0.3: ip-proto-17                                             
13:10:36.618206 breth0 Out ifindex 6 02:42:ac:13:00:02 ethertype IPv4 (0x0800), length 1416: (tos 0x0, ttl 61, id 39428, offset 0, flags [+], proto UDP (17), length 1396)
    172.19.0.2.64204 > 172.19.0.3.9894: UDP, length 1426                                
13:10:36.618264 breth0 Out ifindex 6 02:42:ac:13:00:02 ethertype IPv4 (0x0800), length 98: (tos 0x0, ttl 61, id 39428, offset 1376, flags [none], proto UDP (17), length 78)
    172.19.0.2 > 172.19.0.3: ip-proto-17    
13:10:36.618826 eth0  Out ifindex 288 02:42:ac:13:00:02 ethertype IPv4 (0x0800), length 1416: (tos 0x0, ttl 61, id 39428, offset 0, flags [+], proto UDP (17), length 1396)
    172.19.0.2.64204 > 172.19.0.3.9894: UDP, length 1426
13:10:36.618832 eth0  Out ifindex 288 02:42:ac:13:00:02 ethertype IPv4 (0x0800), length 98: (tos 0x0, ttl 61, id 39428, offset 1376, flags [none], proto UDP (17), length 78)
    172.19.0.2 > 172.19.0.3: ip-proto-17
13:10:36.620354 eth0  In  ifindex 288 02:42:ac:13:00:03 ethertype IPv4 (0x0800), length 1468: (tos 0x0, ttl 64, id 2048, offset 0, flags [DF], proto UDP (17), length 1448)
    172.19.0.3.9894 > 172.19.0.2.64204: UDP, length 1420 --- FYI THIS IS THE PROBLEM, ITS SENDING BACK 1468 SIZED PACKET WHEN THE ONWARD PACKETS WERE FRAGMENTED ONES EACH OF SMALL SIZES...
13:10:36.620675 breth0 In  ifindex 6 02:42:ac:13:00:03 ethertype IPv4 (0x0800), length 1468: (tos 0x0, ttl 64, id 2048, offset 0, flags [DF], proto UDP (17), length 1448)
    172.19.0.3.9894 > 172.19.0.2.64204: UDP, length 1420
13:10:36.620730 breth0 Out ifindex 6 02:42:ac:13:00:02 ethertype IPv4 (0x0800), length 596: (tos 0xc0, ttl 64, id 26721, offset 0, flags [none], proto ICMP (1), length 576)
    172.19.0.2 > 172.19.0.3: ICMP 172.19.0.2 unreachable - need to frag (mtu 1400), length 556
        (tos 0x0, ttl 64, id 2048, offset 0, flags [DF], proto UDP (17), length 1448)                                                                                        
    172.19.0.3.9894 > 172.19.0.2.64204: UDP, length 1420
13:10:36.620745 eth0  Out ifindex 288 02:42:ac:13:00:02 ethertype IPv4 (0x0800), length 596: (tos 0xc0, ttl 64, id 26721, offset 0, flags [none], proto ICMP (1), length 576)
    172.19.0.2 > 172.19.0.3: ICMP 172.19.0.2 unreachable - need to frag (mtu 1400), length 556
        (tos 0x0, ttl 64, id 2048, offset 0, flags [DF], proto UDP (17), length 1448)                                                                                        
```
9. This creates a cached MTU route that stays for 5mins in ovn-control-plane `root@ovn-control-plane:/# ip route get 172.19.0.2
172.19.0.2 dev breth0 src 172.19.0.3 uid 0 
    cache expires 599sec mtu 1400`
10. After this subsequent packets travel correctly and the test is successful.
11. A few seconds after the first test, we can notice some pkts like this in `ovn-control-plane` side:
```
 172.19.0.3.9894 > 172.19.0.2.4005: UDP, length 1420
13:35:09.587904 eth0  Out ifindex 290 02:42:ac:13:00:03 ethertype IPv4 (0x0800), length 92: (tos 0x0, ttl 64, id 5654, offset 1376, flags [none], proto UDP (17), length 72)
    172.19.0.3 > 172.19.0.2: ip-proto-17
13:35:16.727956 lo    In  ifindex 1 00:00:00:00:00:00 ethertype IPv4 (0x0800), length 596: (tos 0xc0, ttl 64, id 21894, offset 0, flags [none], proto ICMP (1), length 576)  
    172.19.0.3 > 172.19.0.3: ICMP 172.19.0.2 unreachable - need to frag (mtu 1400), length 556                                                                               
        (tos 0xc0, ttl 64, id 29181, offset 0, flags [DF], proto TCP (6), length 1500)                                                                                       
    172.19.0.3.6642 > 172.19.0.2.41566: Flags [.], seq 4132822833:4132824281, ack 620867586, win 501, options [nop,nop,TS val 2609532457 ecr 202902353], length 1448         
13:35:16.727964 lo    In  ifindex 1 00:00:00:00:00:00 ethertype IPv4 (0x0800), length 596: (tos 0xc0, ttl 64, id 21895, offset 0, flags [none], proto ICMP (1), length 576)
    172.19.0.3 > 172.19.0.3: ICMP 172.19.0.2 unreachable - need to frag (mtu 1400), length 556
        (tos 0xc0, ttl 64, id 29182, offset 0, flags [DF], proto TCP (6), length 1500) 
    172.19.0.3.6642 > 172.19.0.2.41566: Flags [.], seq 1448:2896, ack 1, win 501, options [nop,nop,TS val 2609532457 ecr 202902353], length 1448
13:35:16.727969 lo    In  ifindex 1 00:00:00:00:00:00 ethertype IPv4 (0x0800), length 596: (tos 0xc0, ttl 64, id 21896, offset 0, flags [none], proto ICMP (1), length 576)
    172.19.0.3 > 172.19.0.3: ICMP 172.19.0.2 unreachable - need to frag (mtu 1400), length 556
        (tos 0xc0, ttl 64, id 29183, offset 0, flags [DF], proto TCP (6), length 1500) 
    172.19.0.3.6642 > 172.19.0.2.41566: Flags [.], seq 2896:4344, ack 1, win 501, options [nop,nop,TS val 2609532457 ecr 202902353], length 1448
13:35:16.727974 lo    In  ifindex 1 00:00:00:00:00:00 ethertype IPv4 (0x0800), length 596: (tos 0xc0, ttl 64, id 21897, offset 0, flags [none], proto ICMP (1), length 576)
    172.19.0.3 > 172.19.0.3: ICMP 172.19.0.2 unreachable - need to frag (mtu 1400), length 556
        (tos 0xc0, ttl 64, id 29184, offset 0, flags [DF], proto TCP (6), length 1500) 
    172.19.0.3.6642 > 172.19.0.2.41566: Flags [.], seq 4344:5792, ack 1, win 501, options [nop,nop,TS val 2609532457 ecr 202902353], length 1448
13:35:16.727979 lo    In  ifindex 1 00:00:00:00:00:00 ethertype IPv4 (0x0800), length 596: (tos 0xc0, ttl 64, id 21898, offset 0, flags [none], proto ICMP (1), length 576)
    172.19.0.3 > 172.19.0.3: ICMP 172.19.0.2 unreachable - need to frag (mtu 1400), length 556
        (tos 0xc0, ttl 64, id 29185, offset 0, flags [DF], proto TCP (6), length 1500) 
    172.19.0.3.6642 > 172.19.0.2.41566: Flags [P.], seq 5792:7240, ack 1, win 501, options [nop,nop,TS val 2609532457 ecr 202902353], length 1448
```
12. Now if the second test is run within the next 5 minutes where the backends are now OVN-k pods, then we get screwed. 
13. In the second case, steps are same except that once OVN GR does the DNAT back to pod backend, the pkt is sent out via GENEVE to ovn-control-plane from ovn-worker.
14. When pkt lands on ovn-control-plane it think is needs to fragment its reply based on the previously cached route and we run into some skewed pkt here that breaks the rest of the test case:
```
    10.244.1.53.9894 > 100.64.0.3.57032: UDP, length 1420
13:35:39.435510 4ea31709c99ae73 P   ifindex 57 0a:58:0a:f4:01:35 ethertype IPv4 (0x0800), length 92: (tos 0x0, ttl 64, id 49359, offset 1376, flags [none], proto UDP (17), length 72)
    10.244.1.53 > 100.64.0.3: ip-proto-17
13:35:39.435520 genev_sys_6081 Out ifindex 6 0a:58:64:40:00:01 ethertype IPv4 (0x0800), length 1416: (tos 0x0, ttl 63, id 49359, offset 0, flags [+], proto UDP (17), length 1396)
    10.244.1.53.9894 > 100.64.0.3.57032: UDP, length 1420
13:35:39.435544 genev_sys_6081 Out ifindex 6 0a:58:64:40:00:01 ethertype IPv4 (0x0800), length 92: (tos 0x0, ttl 63, id 49359, offset 1376, flags [none], proto UDP (17), length 72)
    10.244.1.53 > 100.64.0.3: ip-proto-17
13:35:39.435547 breth0 Out ifindex 5 02:42:ac:13:00:03 ethertype IPv4 (0x0800), length 150: (tos 0x0, ttl 64, id 21451, offset 0, flags [DF], proto UDP (17), length 130)
    172.19.0.3.40913 > 172.19.0.2.6081: Geneve, Flags [C], vni 0x2, proto TEB (0x6558), options [class Open Virtual Networking (OVN) (0x102) type 0x80(C) len 8]
        0a:58:64:40:00:01 > 0a:58:64:40:00:03, ethertype IPv4 (0x0800), length 86: (tos 0x0, ttl 63, id 49359, offset 1376, flags [none], proto UDP (17), length 72)
    10.244.1.53 > 100.64.0.3: ip-proto-17
13:35:39.435549 eth0  Out ifindex 290 02:42:ac:13:00:03 ethertype IPv4 (0x0800), length 150: (tos 0x0, ttl 64, id 21451, offset 0, flags [DF], proto UDP (17), length 130)
    172.19.0.3.40913 > 172.19.0.2.6081: Geneve, Flags [C], vni 0x2, proto TEB (0x6558), options [class Open Virtual Networking (OVN) (0x102) type 0x80(C) len 8]
        0a:58:64:40:00:01 > 0a:58:64:40:00:03, ethertype IPv4 (0x0800), length 86: (tos 0x0, ttl 63, id 49359, offset 1376, flags [none], proto UDP (17), length 72)
    10.244.1.53 > 100.64.0.3: ip-proto-17
13:35:39.435551 lo    In  ifindex 1 00:00:00:00:00:00 ethertype IPv4 (0x0800), length 596: (tos 0xc0, ttl 64, id 35704, offset 0, flags [none], proto ICMP (1), length 576)
    172.19.0.3 > 172.19.0.3: ICMP 172.19.0.2 unreachable - need to frag (mtu 1400), length 556
        (tos 0x0, ttl 64, id 21450, offset 0, flags [DF], proto UDP (17), length 1454)
    172.19.0.3.40913 > 172.19.0.2.6081: Geneve, Flags [C], vni 0x2, proto TEB (0x6558), options [class Open Virtual Networking (OVN) (0x102) type 0x80(C) len 8]
        0a:58:64:40:00:01 > 0a:58:64:40:00:03, ethertype IPv4 (0x0800), length 1410: (tos 0x0, ttl 63, id 49359, offset 0, flags [+], proto UDP (17), length 1396)
    10.244.1.53.9894 > 100.64.0.3.57032: UDP, length 1420
```
15. If we flush the route cache on control-plane or wait for the route mtu entry to get cleared then things work as expected.

**Comment by tssurya** [comment]
Let's see how https://github.com/ovn-org/ovn-kubernetes/pull/3420 works out,
